{
 "coreIssue": "光模块市场情绪是否已进入过热阶段？",
 "summary": "素材中缺乏直接针对光模块的新闻或深度视频，仅有间接涉及CPO/科技硬件链的钱博士直播观点（2026-08-27短线与中长线均看多，其中中长线确定性高）。该观点显示产业链情绪偏向积极，但无法据此量化光模块的估值、成交拥挤度或资金流向，不足以支撑'过热'判断。基于保守推理，目前更可能处于偏暖而非过热状态，继续向上或回调的概率并存，需等待量价和产业数据验证。证据局限：B源未覆盖光模块直接信息，C源无视频素材。",
 "facts": [],
 "opinions": [
  {
   "text": "短线看多 🐂📈（观点未直接点名光模块，但涉及CPO产业链资产）",
   "analyst": "钱博士",
   "date": "2026-08-27",
   "side": "bull"
  },
  {
   "text": "中长线看多 🐂📈（确定性高）（观点未直接点名光模块，但涉及CPO产业链资产）",
   "analyst": "钱博士",
   "date": "2026-08-27",
   "side": "bull"
  }
 ],
 "crossCheck": {
  "consensus": [
   "钱博士对CPO所在的科技硬件链给出短线及中长线看多观点，可视为光模块产业链邻近环节的间接乐观证据。"
  ],
  "disagreements": [
   "当前素材无空方或谨慎观点，缺乏对比差分，无法形成有效的交叉验证。"
  ]
 },
 "expectations": {
  "pricedIn": [
   "钱博士中长线确定性高看多所隐含的产业景气预期可能已在相关标的价格中部分定价。"
  ],
  "upsideVars": [
   "若后续光模块行业出现超预期的海外云厂商资本开支上调、新品良率爬坡加速或订单能见度延长，则当前情绪仍属提前反映而不过热，或继续上行。"
  ],
  "downsideVars": [
   "若出现核心客户资本开支下修、产品价格战或技术路线切换阵痛，高位情绪可能快速降温并转为过度悲观。"
  ]
 },
 "scenarios": [
  {
   "name": "趋势延续、并非过热（基线情景）",
   "condition": "在产业订单和业绩指引保持稳定、无突发利空的前提下，当前偏暖情绪得到基本面承接",
   "outcome": "光模块维持高位震荡上行或缓慢抬升，市场情绪健康偏积极，难以定义'过热'。",
   "probability": 0.4,
   "rationale": "参考钱博士中长线高确定性看多，表明产业趋势大概率可支撑估值消化；缺乏反向证据，故予最大概率。",
   "invalidation": "若出现订单明显下滑或主流公司业绩预告低于预期，情景失效。"
  },
  {
   "name": "情绪过热后快速调整",
   "condition": "若后续出现成交量异常放大、融资余额快速冲刺、卖方一致看多比例达到极端值等过热信号",
   "outcome": "情绪见顶，板块出现10%以上级回撤；若无基本面配合，调整期可能超过一个季度。",
   "probability": 0.3,
   "rationale": "科技硬件板块历史上容易在利好密集期快速透支未来涨幅，钱博士虽看多但短线信号也可能是高位情绪脉冲的映射，故保留三成过热回调可能。",
   "invalidation": "若量价持续健康放大且季报盈利不断上调，过热情景不成立。"
  },
  {
   "name": "情绪未过热，仍有显著上行空间",
   "condition": "如果出现新一轮AIDC/CPO扩容项目或海外大厂加单等产业升级信号，同时市场筹码并未过度集中",
   "outcome": "光模块基本面将继续走强，当前情绪只是景气初期，未来仍有两成以上估值修复空间。",
   "probability": 0.3,
   "rationale": "钱博士中长线高确定性看多可理解为对产业周期的判断，暗示基本面力量仍未释放完。但由于相关证据间接，只给三成。",
   "invalidation": "若估值上升速度远快于业绩增速，则该情景的风险快速累积。"
  }
 ],
 "watchlist": [
  {
   "text": "光模块头部公司滚动市盈率所处近五年分位值",
   "trigger": "若市盈率分位快速拉升至95%以上并持续，说明情绪可能过热。"
  },
  {
   "text": "光模块板块单日成交额/流通市值比例及融资余额周度变化",
   "trigger": "若成交占比或融资增速超过前历史峰值的1.5倍，则可能为情绪过热预警。"
  },
  {
   "text": "北美云厂商/大型互联网公司资本开支指引及光模块大额订单公告",
   "trigger": "若新版指引上调或订单明细超出市场预期，则当前高情绪由基本面驱动，尚未过热；若下修则情绪可能逆转。"
  }
 ],
 "evidence": [
  {
   "id": "钱博士直播-2026-08-27-bull1",
   "source": "钱博士直播",
   "date": "2026-08-27",
   "claim": "钱博士短线看多，观点所涉资产包括CPO等科技硬件链。"
  },
  {
   "id": "钱博士直播-2026-08-27-bull2",
   "source": "钱博士直播",
   "date": "2026-08-27",
   "claim": "钱博士中长线看多，且确定性高，观点所涉资产覆盖CPO等。"
  }
 ],
 "_meta": {
  "goal": "光模块情绪是否过热？",
  "generated_at": "2026-09-03T04:45:25",
  "sources": {
   "local_views": 8,
   "news": 0,
   "bilibili": 0
  },
  "schema_valid": true,
  "job_id": "62670f542a2840388a5511e3a077e6b0"
 },
 "goal": "光模块情绪是否过热？",
 "generatedAt": "2026-09-03T04:45:25"
}