{
 "coreIssue": "黄金ETF的短期多空因素与方向选择：在缺乏基本面数据下，市场情绪和技术位置（4300关口）主导判断。",
 "summary": "综合观点库，黄金短线多空分歧激化：多头认为8月底已悲观过度、中期上涨结构未破坏、闪崩在‘剧本’内；空头指出8月28日短线转空、9月2日出现‘大暴跌延续’‘牛市陷阱确立’等信号，4300美元/盎司是关键关口。中性观点强调波动率加大、消息面扰动剧烈，需等待回调后更好位置。推演判断：若跌破4300并确认，短线大概率下探4250-4220，概率约45%；若守住并重新上攻，反弹至前高概率约30%；若持续拉锯，则进入高波动震荡，概率25%。证据局限：无新闻快讯、无宏观数据，B站视频未看原片，观点多来自标题线索·待核。",
 "facts": [],
 "opinions": [
  {
   "text": "短线看空，不建议短线参与。",
   "analyst": "钱博士",
   "date": "2026-08-28",
   "side": "bear"
  },
  {
   "text": "短线看多，认为市场悲观过度。",
   "analyst": "钱博士",
   "date": "2026-08-27",
   "side": "bull"
  },
  {
   "text": "黄金长期年化收益率与标普指数对比（方向偏空）。",
   "analyst": "钱博士",
   "date": "2026-08-28",
   "side": "bear"
  },
  {
   "text": "短线中性，波动率加大，消息面影响大；需关注下游需求，回调后再参与。",
   "analyst": "钱博士",
   "date": "2026-08-28",
   "side": "neutral"
  },
  {
   "text": "B站UP观点·待核：9.2黄金晚上看好冲高。",
   "analyst": "B站·Dy老猫吃鱼",
   "date": "2026-09-02",
   "side": "bull"
  },
  {
   "text": "B站UP观点·待核：9.2黄金延续下跌超过预期，但中期结构没有破坏，有下跌底线。",
   "analyst": "B站·Dy老猫吃鱼",
   "date": "2026-09-02",
   "side": "neutral"
  },
  {
   "text": "B站UP观点·待核：2026.9.2黄金大暴跌延续，崩盘即将来临，重点关注4300关口，跌破看4250-4220，上方关注4388。",
   "analyst": "B站·指尖金汇-黄金",
   "date": "2026-09-02",
   "side": "bear"
  },
  {
   "text": "B站UP观点·待核：黄金闪崩但在我的剧本中，注重谈未来、历史与基本面问题；9.2暂停杠杆多单，等待更好的无杠杆加仓位置，活下来最重要（长期偏多，短线谨慎）。",
   "analyst": "B站·黄金战士_小久",
   "date": "2026-09-02",
   "side": "neutral"
  },
  {
   "text": "B站UP观点·待核：黄金的牛市陷阱基本确立。",
   "analyst": "B站·玄同波浪_极简交易",
   "date": "2026-09-02",
   "side": "bear"
  },
  {
   "text": "B站UP观点·待核：全网最简单清晰！15分钟掌握黄金分析思路，金价为何屡创新高？（教育性内容，隐含黄金上行背景）",
   "analyst": "B站·投研部杨摸鱼",
   "date": "2026-09",
   "side": "neutral"
  },
  {
   "text": "B站UP观点·待核：一口气了解黄金，为什么暴涨？投资黄金需要注意什么？（教育性内容，隐含黄金上行背景）",
   "analyst": "B站·小Lin说",
   "date": "2026-09",
   "side": "neutral"
  }
 ],
 "crossCheck": {
  "consensus": [
   "短线波动剧烈，市场上多空消息交织，单边重仓或杠杆操作风险大",
   "4300美元/盎司是近期重要心理关口，需要观察价格在该位置的得失",
   "等待更加清晰的信号或更好仓位是关键"
  ],
  "disagreements": [
   "短线方向：钱博士8月27日看多、8月28日转空；指尖金汇认为崩盘将来，Dy老猫吃鱼认为中期结构未破坏",
   "中期格局：玄同波浪称牛市陷阱确立（看空），黄金战士_小久等待无杠杆加仓（长期看多），Dy老猫吃鱼认为回调有底线",
   "观察重点：是破位下行至4250-4220，还是守住4300后重新冲高"
  ]
 },
 "expectations": {
  "pricedIn": [
   "黄金近期已出现一波明显回调或闪崩（根据标题线索）",
   "当前价格处于4300关口附近（有破位叙事，标注为技术位）",
   "市场对美联储/宏观消息高度敏感（钱博士称消息面影响大）"
  ],
  "upsideVars": [
   "若站稳4300并快速收复前期跌幅，可能触发空头回补和再次冲高",
   "若全球央行购金/避险需求等基本面因素继续发酵，下行底线可能坚实",
   "若出现明显利好（如降息预期强化），流动性推动金价突破前高"
  ],
  "downsideVars": [
   "若跌破4300并持续运行，大概率测试4250-4220区域",
   "若因黄金闪崩引发进一步去杠杆，杠杆多头止损抛售将加大下行压力",
   "若牛市陷阱被市场广泛认可，中线资金撤离，形成螺旋下跌"
  ]
 },
 "scenarios": [
  {
   "name": "破位下行加速",
   "condition": "黄金价格有效跌破4300关口，并收盘在其下方",
   "outcome": "短线看空势力主导，价格顺势下探4250-4220支撑区；若该支撑无效，可能打开更深下跌空间，杠杆资金继续离场",
   "probability": 0.45,
   "rationale": "9月2日多个B站标题直接指向暴跌延续、牛市陷阱确立，钱博士8月28日由多转空，技术叙事集中于4300破位；若跌破，市场情绪阻力位转支撑，趋势力量增强",
   "invalidation": "价格快速收回4300上方并放量持稳"
  },
  {
   "name": "企稳后反弹",
   "condition": "4300关口形成支撑，价格在2-3日内重新站稳并向上挑战4388以上",
   "outcome": "超跌情绪修复，短期多头重新占优，黄金ETF有望反弹至前高附近；中期上涨结构得以维持",
   "probability": 0.3,
   "rationale": "钱博士8月27日曾认为市场悲观过度；Dy老猫吃鱼暗示中期结构未破坏且有下跌底线；黄金战士_小久虽暂停杠杆多单但等待无杠杆加仓位置，说明长线多头仍存",
   "invalidation": "价格再次跌破4300，或反弹面临明显缩量/受阻迹象"
  },
  {
   "name": "高位宽幅震荡",
   "condition": "价格在4300一带反复争夺，既无法快速跌破也无法强攻上方",
   "outcome": "短期无明确单边方向，消息面主导日内波动，杠杆资金被反复清洗，市场等待新的宏观或基本面指引",
   "probability": 0.25,
   "rationale": "钱博士8月28日同时给出看空和中性两种判断（波动率加大、关注下游需求），且各UP对中期结构多空不一，显示市场缺乏一致方向，容易形成区间震荡",
   "invalidation": "出现重要数据或消息打破4300附近的平衡（单日波幅显著放大并站稳某个方向）"
  }
 ],
 "watchlist": [
  {
   "text": "黄金价格是否有效跌破4300美元/盎司关口",
   "trigger": "若跌破并收盘持续低于4300 → 说明空头突破关键阻力，下跌目标看4250-4220；若反复收盘站在4300以上 → 说明下方有承接，空头突破失败"
  },
  {
   "text": "消息面与波动率变化",
   "trigger": "若重大数据或政策声明引发金价大幅跳动、波动率显著上升 → 说明市场仍由情绪主导，短线方向取决于消息解读，应避免杠杆追单"
  },
  {
   "text": "杠杆资金去留",
   "trigger": "若出现杠杆多单暂停/减持、融资余额下降 → 说明市场进入去杠杆阶段，短线仍有下行风险；若杠杆资金重新进场 → 说明风险偏好回升，回调可能结束"
  },
  {
   "text": "中期上升结构是否完好",
   "trigger": "若金价跌至4250-4220后快速反弹，说明中期上升趋势线/支撑有效 → 中期多头未破坏，可关注无杠杆加仓信号；若长期趋势线被跌破 → 说明牛市逻辑可能逆转"
  }
 ],
 "evidence": [
  {
   "id": "钱博士直播-2026-08-27",
   "source": "钱博士直播",
   "date": "2026-08-27",
   "claim": "钱博士观点：短线看多，认为市场悲观过度。"
  },
  {
   "id": "钱博士直播-2026-08-28",
   "source": "钱博士直播",
   "date": "2026-08-28",
   "claim": "钱博士观点：短线看空，不建议短线参与；另有观点为黄金长期年化收益率与标普对比；同时短线中性（波动率加大，消息面影响大，关注下游需求）。"
  },
  {
   "id": "B站·Dy老猫吃鱼-2026-09-02",
   "source": "B站·Dy老猫吃鱼",
   "date": "2026-09-02",
   "claim": "标题线索（待核）：9.2黄金晚上看好冲高；同日又说黄金延续下跌超过预期，但中期结构没有破坏，有下跌底线。"
  },
  {
   "id": "B站·指尖金汇-黄金-2026-09-02",
   "source": "B站·指尖金汇-黄金",
   "date": "2026-09-02",
   "claim": "标题线索（待核）：2026.9.2黄金大暴跌延续，崩盘即将来临，熊市又开始了吗？重点关注4300关口，跌破则可能延续下跌4250-4220区域，上方关注4388。"
  },
  {
   "id": "B站·黄金战士_小久-2026-09-02",
   "source": "B站·黄金战士_小久",
   "date": "2026-09-02",
   "claim": "标题线索（待核）：黄金闪崩但在我的剧本中，谈谈黄金的未来与历史以及基本面问题；9.2暂停杠杆多单，等待更好的无杠杆加仓位置，活下来是最重要的。"
  },
  {
   "id": "B站·玄同波浪_极简交易-2026-09-02",
   "source": "B站·玄同波浪_极简交易",
   "date": "2026-09-02",
   "claim": "标题线索（待核）：黄金的牛市陷阱基本确立。"
  },
  {
   "id": "B站·投研部杨摸鱼-2026-09",
   "source": "B站·投研部杨摸鱼",
   "date": "2026-09",
   "claim": "标题线索（待核）：全网最简单清晰！15分钟掌握黄金的分析思路，金价为何屡创新高？"
  },
  {
   "id": "B站·小Lin说-2026-09",
   "source": "B站·小Lin说",
   "date": "2026-09",
   "claim": "标题线索（待核）：【硬核】一口气了解黄金|为什么暴涨?投资黄金需要注意什么?"
  }
 ],
 "_meta": {
  "goal": "黄金 ETF 的多空因素有哪些？",
  "generated_at": "2026-09-03T04:39:44",
  "sources": {
   "local_views": 8,
   "news": 0,
   "bilibili": 8
  },
  "schema_valid": true,
  "job_id": "e0df2833aa2148fdabdb955062a7ed10"
 },
 "goal": "黄金 ETF 的多空因素有哪些？",
 "generatedAt": "2026-09-03T04:39:44"
}