{
 "coreIssue": "黄金短线方向在多日内由看多转向看空/中性，叠加长期收益率对比弱势，当前持仓面临哪些不确定与风险？",
 "summary": "本地观点库显示，钱博士直播对黄金短线的判断在2026-08-27为看多（认为市场悲观过度），但2026-08-28转为看空（不建议短线参与）及中性（波动率加大、需关注下游需求），观点快速反转揭示市场情绪主导、方向分歧巨大。另有观点指出黄金长期年化收益率弱于标普，暗示长期配置价值承压。基于此，推演三种情景：短线情绪修复反弹概率约35%，高位震荡或回调概率约45%，长期相对弱势概率约20%。三种情景自洽但均非预测，仅为情景分析。当前没有可验证的新闻事实，所有判断仅来自单一直播间观点，证据局限：B区新闻源与C区视频未覆盖。",
 "facts": [],
 "opinions": [
  {
   "text": "短线：看空，不建议短线参与",
   "analyst": "钱博士直播",
   "date": "2026-08-28",
   "side": "bear"
  },
  {
   "text": "短线：看多，认为市场悲观过度（该观点在素材中出现两次）",
   "analyst": "钱博士直播",
   "date": "2026-08-27",
   "side": "bull"
  },
  {
   "text": "黄金长期年化收益率与标普对比处于弱势，暗示长期看空",
   "analyst": "钱博士直播",
   "date": "2026-08-28",
   "side": "bear"
  },
  {
   "text": "短线：中性，需关注下游需求，回调后再参与",
   "analyst": "钱博士直播",
   "date": "2026-08-28",
   "side": "neutral"
  },
  {
   "text": "短线：中性，波动率加大，消息面影响大",
   "analyst": "钱博士直播",
   "date": "2026-08-28",
   "side": "neutral"
  }
 ],
 "crossCheck": {
  "consensus": [
   "黄金短线波动受情绪和消息面驱动，基本面权重较低",
   "短线操作难度大，不宜贸然追涨杀跌"
  ],
  "disagreements": [
   "短线方向：2026-08-27看多（悲观过度）与2026-08-28看空（不建议参与）直接矛盾",
   "长期与短期评估分歧：长期看空收益率对比，但短线中性或反弹诉求并存"
  ]
 },
 "expectations": {
  "pricedIn": [
   "2026-08-27的市场悲观预期已被价格部分反映",
   "短线波动率上升及消息面不确定性已被市场认识"
  ],
  "upsideVars": [
   "若市场情绪快速修复，纠正过度悲观，黄金可能出现超跌反弹",
   "若下游需求数据超预期，回调后或提供再参与机会"
  ],
  "downsideVars": [
   "若消息面出现超预期利空，波动率进一步放大，短线下行风险加剧",
   "若黄金长期年化收益率延续弱于标普，资金或持续流向权益市场"
  ]
 },
 "scenarios": [
  {
   "name": "短线情绪修复反弹",
   "condition": "市场悲观情绪被纠正，出现技术性企稳或消息面利多刺激",
   "outcome": "黄金价格从超跌中反弹，回补前期跌幅",
   "probability": 0.35,
   "rationale": "钱博士2026-08-27明确认为市场悲观过度，极端悲观往往孕育短期反转；且8月28日虽转空，但中性观点也提示回调后参与，说明下方存在承接意愿。",
   "invalidation": "价格跌破近期关键支撑，或出现超预期鹰派货币政策/避险需求大幅消退"
  },
  {
   "name": "高位震荡/短线调整",
   "condition": "缺乏方向性驱动，消息面多空交织，波动率维持高位",
   "outcome": "黄金价格区间宽幅震荡，方向不明，持仓等待",
   "probability": 0.45,
   "rationale": "8月28日两个中性观点均强调波动率加大和关注下游需求，反映短线缺乏一致方向，胜率偏低；多日观点反转也说明市场处于无趋势的争夺状态。",
   "invalidation": "价格向某一方向有效突破区间且伴随放量，或出现明确的宏观趋势信号"
  },
  {
   "name": "长期相对弱势",
   "condition": "黄金长期年化收益率持续跑输标普，投资者更偏好股市收益",
   "outcome": "黄金配置需求中长期走低，价格重心逐步下移",
   "probability": 0.2,
   "rationale": "钱博士在2026-08-28直接对比黄金与标普长期年化收益率，指向黄金长期回报劣势；若经济不出现系统性风险，该比较逻辑将持续压制黄金的长期吸引力。",
   "invalidation": "通胀大幅超预期、地缘政治长期恶化或股市进入深度熊市，使黄金避险价值回归"
  }
 ],
 "watchlist": [
  {
   "text": "市场情绪指标（如持仓、波动率、资金流向）",
   "trigger": "若出现持续净流入且波动率回落，说明8月27日“悲观过度”逻辑开始兑现，短线反弹概率上升"
  },
  {
   "text": "重要经济数据或央行政策消息",
   "trigger": "若公布的通胀/就业/利率决议与预期差异大，验证“消息面影响大”的判断，并决定短线突破方向"
  },
  {
   "text": "黄金下游需求数据（消费、工业、ETF购买）",
   "trigger": "若需求数据明显改善，印证“需关注下游需求”和“回调后再参与”逻辑，可能提供中线支撑"
  },
  {
   "text": "黄金与标普长期年化收益率对比追踪",
   "trigger": "若两者差距继续走阔，强化长期看空观点；若收敛则削弱该长期看空逻辑"
  }
 ],
 "evidence": [
  {
   "id": "钱博士直播-2026-08-28-1",
   "source": "钱博士直播",
   "date": "2026-08-28",
   "claim": "短线看空，不建议短线参与黄金"
  },
  {
   "id": "钱博士直播-2026-08-27-1",
   "source": "钱博士直播",
   "date": "2026-08-27",
   "claim": "短线看多，认为市场悲观过度（该观点重复出现两次）"
  },
  {
   "id": "钱博士直播-2026-08-28-2",
   "source": "钱博士直播",
   "date": "2026-08-28",
   "claim": "黄金长期年化收益率与标普对比处于弱势，暗示长期看空"
  },
  {
   "id": "钱博士直播-2026-08-28-3",
   "source": "钱博士直播",
   "date": "2026-08-28",
   "claim": "短线中性，需关注下游需求，回调后再参与"
  },
  {
   "id": "钱博士直播-2026-08-28-4",
   "source": "钱博士直播",
   "date": "2026-08-28",
   "claim": "短线中性，波动率加大，消息面影响大"
  }
 ],
 "_meta": {
  "goal": "黄金价格波动对当前持仓的影响与风险",
  "generated_at": "2026-09-03T18:45:56",
  "sources": {
   "local_views": 8,
   "news": 0,
   "bilibili": 0
  },
  "schema_valid": true,
  "job_id": "f43e50f906b8455d9141b0df8022476a"
 },
 "goal": "黄金价格波动对当前持仓的影响与风险",
 "generatedAt": "2026-09-03T18:45:56"
}