{
 "coreIssue": "半导体板块在财报超预期但指引偏弱、分析师观点多空切换背景下，后续行情方向如何选择？",
 "summary": "近一周半导体板块多空分歧加剧：钱博士观点由8/27中长线看空，到8/29转多，短线判断亦在偏多/中性/看空间摇摆；博通三季报AI半导体营收167亿美元大超预期，但第四财季指引348亿略低预期，盘后跌4%，显示高增已定价、对指引瑕疵敏感。综合来看，短期或高位震荡消化分歧；若AI需求持续获财报验证，则有望突破上行；若指引连续下修，则回调风险加大。情景概率：上行40%、震荡35%、回调25%。证据局限：B区仅一条新闻，A区仅钱博士一人且观点多变，未覆盖半导体指数具体行情走势数据。",
 "facts": [
  {
   "text": "博通第三财季调整后净收入295.9亿美元，超分析师预期（294.5亿）；半导体解决方案收入208.4亿美元，超预期（205.1亿）；AI半导体营收167亿美元，超预期（159.3亿）；调整后EPS为3.32美元，超预期（3.23美元）；预计第四财季营收约348亿美元，低于分析师预期（350.5亿美元）；博通美股盘后跌4%。",
   "source": "新浪7x24",
   "date": "2026-09-03"
  }
 ],
 "opinions": [
  {
   "text": "中长线看空半导体板块",
   "analyst": "钱博士直播",
   "date": "2026-08-27",
   "side": "bear"
  },
  {
   "text": "短线中性偏多",
   "analyst": "钱博士直播",
   "date": "2026-08-27",
   "side": "bull"
  },
  {
   "text": "短线中性（确定性低）",
   "analyst": "钱博士直播",
   "date": "2026-08-27",
   "side": "neutral"
  },
  {
   "text": "短线看空",
   "analyst": "钱博士直播",
   "date": "2026-08-27",
   "side": "bear"
  },
  {
   "text": "中长线看多",
   "analyst": "钱博士直播",
   "date": "2026-08-29",
   "side": "bull"
  }
 ],
 "crossCheck": {
  "consensus": [
   "半导体行情高度依赖财报与AI需求指引",
   "短线操作确定性偏低，需等方向明确"
  ],
  "disagreements": [
   "中长线方向在8/27看空与8/29看多之间切换",
   "短线观点在同一日存在看空、中性、中性偏多等多种判断"
  ]
 },
 "expectations": {
  "pricedIn": [
   "AI半导体高增长已计入股价（博通超预期但盘后下跌）",
   "半导体板块对指引瑕疵高度敏感"
  ],
  "upsideVars": [
   "后续核心公司财报中AI相关收入持续超预期并上修指引",
   "存储/设备等细分领域景气度验证回升"
  ],
  "downsideVars": [
   "第四财季指引偏弱预示增长动能放缓",
   "若后续财报密集期出现指引下修，或引发板块集体调整"
  ]
 },
 "scenarios": [
  {
   "name": "趋势上行",
   "condition": "博通盘后企稳回升，或后续头部AI芯片公司财报/指引继续超预期，钱博士中长线看多得到基本面验证。",
   "outcome": "半导体板块在AI需求强劲带动下突破上行，资金加速流入。",
   "probability": 0.4,
   "rationale": "博通AI半导体营收超预期反映真实需求饱满；钱博士8/29转多可能代表资金情绪回暖；但指引略低限制了立即冲高的动能，故概率给40%但非绝对。",
   "invalidation": "博通或主要AI芯片公司指引下修，或股价无法收复财报后跌幅。"
  },
  {
   "name": "高位震荡",
   "condition": "多空双方维持拉锯，财报数据喜忧参半，指数在现有区间内反复。",
   "outcome": "半导体板块窄幅波动，等待更多方向性信号。",
   "probability": 0.35,
   "rationale": "钱博士短线观点分歧（看空/中性/偏多并存），博通财报超预期但指引谨慎，多空力量相对均衡；历史经验显示高波动后常进入整理，故这一情景概率与上行相近。",
   "invalidation": "指数放量突破区间上沿或下沿。"
  },
  {
   "name": "回调风险",
   "condition": "若财报后期市场对AI资本开支持续性产生怀疑，或指数跌破关键支撑，伴随资金流出。",
   "outcome": "半导体板块出现一轮调整，消化前期涨幅。",
   "probability": 0.25,
   "rationale": "博通第四财季指引低于预期导致盘后跌4%，表明当前估值对任何边际利空都非常敏感；技术面高位滞涨和短线看空观点也为回调提供触发条件。",
   "invalidation": "随后出现超预期正向消息推动指数创阶段新高。"
  }
 ],
 "watchlist": [
  {
   "text": "博通后续美股走势能否收复财报后跌幅",
   "trigger": "若连续反弹回补缺口→市场对指引解读为过度悲观，半导体情绪或修复；若继续下探→看空情绪主导，板块承压。"
  },
  {
   "text": "钱博士后续是否维持中长线看多，以及短线观点是否统一",
   "trigger": "若维持看多并收敛短线分歧→多头信心增强；若再次转向看空或短线看空集中→板块可能面临新一轮抛压。"
  },
  {
   "text": "存储芯片、半导体设备、CPO等细分板块走势（素材中涉及的相关资产）",
   "trigger": "若这些细分放量上行→确认资金对产业外围景气度的信心；若同步走弱→半导体整体下行风险加大。"
  },
  {
   "text": "后续核心半导体公司财报对AI营收的指引",
   "trigger": "若新一轮指引全面上调→支撑板块估值扩张；若出现下修→盈利预期下调，形成下跌负反馈。"
  }
 ],
 "evidence": [
  {
   "id": "新浪7x24-2026-09-03",
   "source": "新浪7x24",
   "date": "2026-09-03",
   "claim": "博通三财季净收入295.9亿美元、半导体方案收入208.4亿美元、AI半导体营收167亿美元，均超预期；第四财季营收指引348亿低于预期；盘后跌4%。"
  },
  {
   "id": "钱博士直播-2026-08-27",
   "source": "钱博士直播",
   "date": "2026-08-27",
   "claim": "发表中长线看空观点，同时对短线持有中性偏多/中性/看空等不同方向判断。"
  },
  {
   "id": "钱博士直播-2026-08-29",
   "source": "钱博士直播",
   "date": "2026-08-29",
   "claim": "中长线观点转为看多。"
  }
 ],
 "_meta": {
  "goal": "复盘半导体板块近一周走势，梳理多空分歧与后续情景",
  "generated_at": "2026-09-03T04:26:03",
  "sources": {
   "local_views": 8,
   "news": 1,
   "bilibili": 0
  },
  "schema_valid": true,
  "job_id": "b6e96f2717de48f1b9e8faefad64e67d"
 },
 "goal": "复盘半导体板块近一周走势，梳理多空分歧与后续情景",
 "generatedAt": "2026-09-03T04:26:03"
}