{
 "coreIssue": "AI算力板块有哪些可跟踪的验证指标，以判断中长线看多逻辑是否持续有效",
 "summary": "基于现有素材，B区新闻与C区视频均为空，客观事实缺失；A区仅有钱博士直播在2026-08-27至08-28给出的观点。其对AI算力相关资产中长线看多且确定性高，短线则同时存在看多与中性分歧。无法从素材中直接提取验证指标，本研究从观点涉及的资产类别推断，可将存储芯片价格、半导体设备订单、CPO产业进展、科创50走势及消费电子需求作为AI算力板块的验证指标。推演上，中长线看多逻辑一致性较强，情景一（震荡上行）概率约0.7；短线中性不确定性构成情景二（高位震荡）概率约0.3。后续需跟踪上述指标以验证中性判断是否转向。证据局限：B区新闻未覆盖、C区视频未覆盖，指标体系为推断性建议。",
 "facts": [],
 "opinions": [
  {
   "text": "短线看多，涉及半导体、存储芯片、科创50、消费电子、CPO",
   "analyst": "钱博士直播",
   "date": "2026-08-27",
   "side": "bull"
  },
  {
   "text": "短线中性，确定性低",
   "analyst": "钱博士直播",
   "date": "2026-08-27",
   "side": "neutral"
  },
  {
   "text": "中长线看多，确定性高",
   "analyst": "钱博士直播",
   "date": "2026-08-28",
   "side": "bull"
  }
 ],
 "crossCheck": {
  "consensus": [
   "中长线看多AI算力相关资产，且确定性高",
   "涉及资产方向集中在半导体、存储芯片、CPO、科创50等"
  ],
  "disagreements": [
   "短线方向存在分歧：一方看多，另一方认为中性（确定性低）"
  ]
 },
 "expectations": {
  "pricedIn": [
   "中长线看多逻辑已在分析师观点中形成一致性预期"
  ],
  "upsideVars": [
   "存储芯片价格、半导体设备订单、CPO产业需求等验证指标若超预期，将强化上行逻辑"
  ],
  "downsideVars": [
   "若验证指标显示景气度低于预期，或市场风险偏好下降，则短线不确定性可能转为下行压力"
  ]
 },
 "scenarios": [
  {
   "name": "中长线上行延续",
   "condition": "AI算力核心环节（存储、半导体设备、CPO等）景气数据持续验证，且无重大外部冲击",
   "outcome": "板块在产业趋势驱动下震荡向上，中长线看多观点兑现",
   "probability": 0.7,
   "rationale": "观点库中2026-08-27至08-28钱博士直播反复确认中长线看多且确定性高，且无任何看空观点；短线不确定性仅是波动而非根本方向改变",
   "invalidation": "出现行业景气拐点或系统性利空，如存储价格持续下行、设备订单大幅缩减"
  },
  {
   "name": "短线震荡/回调风险",
   "condition": "新增验证指标未出现或表现低于预期，市场难有增量资金",
   "outcome": "板块可能横盘震荡或技术性调整，等待方向",
   "probability": 0.3,
   "rationale": "钱博士直播在2026-08-27另给出短线中性（确定性低），说明当下缺乏明确短期催化；B区新闻为空，无新基本面证据支持立即突破",
   "invalidation": "出现如半导体设备新增大单、存储提价等突发利好，则短线不确定性解除"
  }
 ],
 "watchlist": [
  {
   "text": "存储芯片现货及合约价格走势（关注长存/长鑫等）",
   "trigger": "若价格环比上行→反映AI服务器对存储需求强劲，验证板块景气；若下行→需求动能减弱"
  },
  {
   "text": "半导体设备月度招标/订单数据",
   "trigger": "若订单持续增长→显示晶圆厂扩产意愿强，AI算力上游资本开支周期性上行；若下滑→扩产逻辑受损"
  },
  {
   "text": "CPO（共封装光学）产业链出货/客户导入进展",
   "trigger": "若批量化出货或大厂采购落地→AI集群互联需求确认；若延后→对光模块及AI硬件链估值有压力"
  },
  {
   "text": "科创50指数成交与方向选择",
   "trigger": "若放量突破平台→市场风险偏好回暖，利好科技成长；若缩量阴跌→压制AI算力板块情绪"
  },
  {
   "text": "消费电子销量及创新周期指标",
   "trigger": "若终端需求超预期→边缘AI/端侧算力逻辑强化；若疲弱→相关半导体需求有下调风险"
  }
 ],
 "evidence": [
  {
   "id": "钱博士-20260827-短线多",
   "source": "钱博士直播",
   "date": "2026-08-27",
   "claim": "短线看多，涉及半导体、存储芯片、科创50、消费电子、CPO"
  },
  {
   "id": "钱博士-20260827-短线中性",
   "source": "钱博士直播",
   "date": "2026-08-27",
   "claim": "短线中性，确定性低"
  },
  {
   "id": "钱博士-20260828-中长线多",
   "source": "钱博士直播",
   "date": "2026-08-28",
   "claim": "中长线看多，确定性高"
  }
 ],
 "_meta": {
  "goal": "AI 算力板块有哪些验证指标？",
  "generated_at": "2026-09-03T04:43:16",
  "sources": {
   "local_views": 8,
   "news": 0,
   "bilibili": 0
  },
  "schema_valid": true,
  "job_id": "3661e5ec58d9497890dc06f7a9613076"
 },
 "goal": "AI 算力板块有哪些验证指标？",
 "generatedAt": "2026-09-03T04:43:16"
}