{
 "coreIssue": "8月地产板块在政策预期与房企盈利模式重构之间博弈，9月政策情景如何推演？",
 "summary": "素材显示，8月地产板块受8.28房产新政预期影响，多空分歧显著。以钱博士为代表的中长期看多观点与短期看空观点并存；花旗认为8-10月存在修复窗口，部分自媒体预期将出现史上最大补贴。但B区缺乏国内地产客观数据，复盘基础薄弱。综合推演，9月若出现强刺激政策（概率约0.3），板块或迎修复；若政策温和落地（概率约0.4），则震荡分化；若政策落空（概率约0.3），下行风险仍存。证据局限：B区新闻源未覆盖国内地产，仅美联储褐皮书提供宏观背景。",
 "facts": [
  {
   "text": "美联储褐皮书显示美国经济小幅温和扩张，消费分化，关税推升成本压力，就业市场持平，物价温和上涨。",
   "source": "新浪7x24",
   "date": "2026-09-03"
  }
 ],
 "opinions": [
  {
   "text": "地产板块短线中性偏多，中长线看多。",
   "analyst": "钱博士直播",
   "date": "2026-08-12",
   "side": "bull"
  },
  {
   "text": "地产板块中长线看多。",
   "analyst": "钱博士直播",
   "date": "2026-08-16",
   "side": "bull"
  },
  {
   "text": "对汇贤产业信托（港股REITs）短线看空。",
   "analyst": "钱博士直播",
   "date": "2026-08-13",
   "side": "bear"
  },
  {
   "text": "地产股与物业股的选择框架：博反弹/高波动选深度折价地产股（beta），长期投资选物业股（alpha）。",
   "analyst": "钱博士直播",
   "date": "2026-08-12",
   "side": "neutral"
  },
  {
   "text": "8.28房产新政将彻底重构房地产公司的现金流和盈利模式（标题线索·待核）。",
   "analyst": "B站·货币法则研习社",
   "date": "近期",
   "side": "neutral"
  },
  {
   "text": "房地产倒立洗头（下跌），物业股跟跌；现房销售制度的核心是比谁的融资利率更低（标题线索·待核）。",
   "analyst": "B站·史诗级韭菜",
   "date": "近期",
   "side": "bear"
  },
  {
   "text": "房地产市场或将迎来新阶段（标题线索·待核）。",
   "analyst": "B站·李大霄",
   "date": "近期",
   "side": "neutral"
  },
  {
   "text": "大摩对房地产新政进行解析，具体方向未明（标题线索·待核）。",
   "analyst": "B站·源头信息哥",
   "date": "近期",
   "side": "neutral"
  },
  {
   "text": "经济全线转冷，房地产可能迎来史上最大补贴（标题线索·待核）。",
   "analyst": "B站·CLS同学",
   "date": "近期",
   "side": "bull"
  },
  {
   "text": "花旗认为8-10月地产板块迎来修复窗口（标题线索·待核）。",
   "analyst": "B站·顶级投行行业跟踪",
   "date": "近期",
   "side": "bull"
  }
 ],
 "crossCheck": {
  "consensus": [
   "政策端必然有动作，地产行业盈利模式正在重构",
   "中长期地产板块具备配置价值"
  ],
  "disagreements": [
   "短期方向：钱博士对REITs看空，而花旗看多8-10月修复窗口",
   "政策力度：史诗级韭菜认为下跌，CLS同学预期史上最大补贴"
  ]
 },
 "expectations": {
  "pricedIn": [
   "地产政策宽松预期已被市场反复交易",
   "8.28新政对房企现金流影响已被部分定价"
  ],
  "upsideVars": [
   "若9月出台直接购房补贴或显著降息，可能启动修复行情",
   "若大摩新政解析偏积极且花旗修复窗口验证，情绪转好"
  ],
  "downsideVars": [
   "若经济数据持续转冷，地产销售继续下滑",
   "若现房销售制度改革导致房企融资成本上升，板块承压"
  ]
 },
 "scenarios": [
  {
   "name": "9月政策强刺激",
   "condition": "官方推出史上最大规模购房补贴或大幅下调房贷利率",
   "outcome": "地产板块报复性反弹，物业股跟随，现金流良好房企领涨",
   "probability": 0.3,
   "rationale": "CLS同学提出‘史上最大补贴’预期，花旗提出修复窗口，若政策兑现，市场将从预期交易转为现实驱动。",
   "invalidation": "央行或财政部未出台补贴/降息，或消息证伪"
  },
  {
   "name": "9月温和政策落地",
   "condition": "8.28新政配套细则出台，未超预期但方向明确",
   "outcome": "板块震荡，个股分化，深度折价高beta股波动大，物业股相对稳健",
   "probability": 0.4,
   "rationale": "8.28新政核心是现金流重构，货币法则研习社提示盈利模式变化；钱博士框架提示短期博beta、长期选物业，对应震荡分化。",
   "invalidation": "政策细则无法执行或出现负面事件"
  },
  {
   "name": "9月政策落空或外部冲击",
   "condition": "政策推迟或仅有象征性措施；美国经济关税压力传导",
   "outcome": "板块继续下跌，地产与物业股齐跌",
   "probability": 0.3,
   "rationale": "史诗级韭菜视频标题明确看空；美联储褐皮书显示关税成本压力，若中美债务/土地问题发酵，风险偏好回落。",
   "invalidation": "出现超预期政策对冲（如降准降息）"
  }
 ],
 "watchlist": [
  {
   "text": "8.28房产新政的配套细则（特别是现房销售资金监管、融资利率）",
   "trigger": "若细则明确且对房企现金流友好，说明温和或强刺激政策落地；若严苛，则下行风险加大"
  },
  {
   "text": "是否出现“购房补贴”“降息降准”等字样的政策公告",
   "trigger": "若出现，对应强刺激情景概率上升；若无，则维持震荡或下行"
  },
  {
   "text": "地产板块成交量与估值波动",
   "trigger": "若放量上涨，验证花旗8-10月修复窗口；若缩量阴跌，情绪未改善"
  },
  {
   "text": "物业股相对地产股强弱",
   "trigger": "物业股走强说明资金偏好alpha；若物业跟跌地产，则板块系统性风险升温"
  }
 ],
 "evidence": [
  {
   "id": "新浪7x24-20260903",
   "source": "新浪7x24",
   "date": "2026-09-03",
   "claim": "美联储褐皮书显示美国经济小幅温和扩张，消费分化，关税推升成本压力"
  },
  {
   "id": "钱博士直播-20260812",
   "source": "钱博士直播",
   "date": "2026-08-12",
   "claim": "地产板块短线中性偏多，中长线看多；并给出地产股vs物业股框架"
  },
  {
   "id": "钱博士直播-20260813",
   "source": "钱博士直播",
   "date": "2026-08-13",
   "claim": "对汇贤产业信托短线看空"
  },
  {
   "id": "钱博士直播-20260816",
   "source": "钱博士直播",
   "date": "2026-08-16",
   "claim": "地产板块中长线看多"
  },
  {
   "id": "货币法则研习社-近期",
   "source": "货币法则研习社",
   "date": "近期",
   "claim": "8.28房产新政将重构房企现金流和盈利模式"
  },
  {
   "id": "史诗级韭菜-近期",
   "source": "史诗级韭菜",
   "date": "近期",
   "claim": "房地产下跌，物业股跟跌，现房销售制度核心是比较融资利率"
  },
  {
   "id": "李大霄-近期",
   "source": "李大霄",
   "date": "近期",
   "claim": "房地产市场或将迎来新阶段"
  },
  {
   "id": "源头信息哥-近期",
   "source": "源头信息哥",
   "date": "近期",
   "claim": "大摩房地产新政解析"
  },
  {
   "id": "CLS同学-近期",
   "source": "CLS同学",
   "date": "近期",
   "claim": "经济全线转冷，房地产可能迎来史上最大补贴"
  },
  {
   "id": "顶级投行行业跟踪-近期",
   "source": "顶级投行行业跟踪",
   "date": "近期",
   "claim": "花旗：8-10月地产板块迎来修复窗口"
  }
 ],
 "_meta": {
  "goal": "复盘 8 月地产板块，推演 9 月政策情景",
  "generated_at": "2026-09-03T04:35:31",
  "sources": {
   "local_views": 8,
   "news": 1,
   "bilibili": 7
  },
  "schema_valid": true,
  "job_id": "a4f8f40a402b481ba6bce580bd7f2cad"
 },
 "goal": "复盘 8 月地产板块，推演 9 月政策情景",
 "generatedAt": "2026-09-03T04:35:31"
}